{
  "schema_version": 1,
  "comment": "Example only. Copy to machine.local.json and adjust locally; do not commit the copied file.",
  "data_directory": "C:/BigQMT/work/kitling_bigqmt/runtime_data",
  "coordinator": {
    "endpoint": "http://192.0.2.121:18443",
    "host_id": "REPLACE_WITH_THIS_WINDOWS_HOST_IP"
  },
  "environments": {
    "simulation": {
      "qmt_root": "C:/BigQMT/work/国金QMT交易端模拟",
      "redis": { "host": "127.0.0.1", "port": 6379, "db": 5 },
      "dashboard_port": 17890,
      "ready_port": 58600
    },
    "production_readonly": {
      "qmt_root": "C:/BigQMT/work/国金证券QMT交易端",
      "redis": { "host": "127.0.0.1", "port": 6380, "db": 5 },
      "dashboard_port": 17891,
      "ready_port": 58600
    }
  }
}
