{
  "schema_version": 1,
  "comment": "192.0.2.105 development and current simulation executor candidate. Template only.",
  "data_directory": "runtime_data",
  "coordinator": { "endpoint": "http://192.0.2.121:18443", "host_id": "192.0.2.105" },
  "environments": {
    "simulation": { "qmt_root": "qmt/simulation", "redis": { "host": "127.0.0.1", "port": 6379, "db": 5 }, "dashboard_port": 17890, "ready_port": 58600 },
    "production_readonly": { "qmt_root": "qmt/production_readonly", "redis": { "host": "127.0.0.1", "port": 6380, "db": 5 }, "dashboard_port": 17891, "ready_port": 58600 }
  }
}
